{
  "$schema": "https://json-schema.org/draft/2020-12/schema",
  "$id": "https://venerax.app/schemas/ir_v0_2.schema.json",
  "title": "VeneraSourceIntermediateRepresentation_v0_2",
  "description": "Minimal Intermediate Representation (IR) v0.2 schema for converted comic sources",
  "type": "object",
  "required": [
    "schemaVersion",
    "id",
    "name",
    "languages",
    "contentOrigins",
    "contentWarning",
    "sourceType",
    "baseUrl",
    "explore",
    "search",
    "details",
    "chapters",
    "pages"
  ],
  "additionalProperties": false,
  "properties": {
    "schemaVersion": {
      "type": "string",
      "pattern": "^0\\.2(\\.[0-9]+)?$"
    },
    "artifactId": {
      "type": "string",
      "pattern": "^[a-z0-9]+(?:_[a-z0-9]+)*$"
    },
    "version": {
      "type": "string",
      "pattern": "^[0-9]+\\.[0-9]+\\.[0-9]+$"
    },
    "id": {
      "type": "string",
      "minLength": 1
    },
    "name": {
      "type": "string",
      "minLength": 1
    },
    "languages": {
      "type": "array",
      "items": {
        "type": "string",
        "pattern": "^[a-z]{2,3}(?:-[A-Z][a-z]{3})?(?:-(?:[A-Z]{2}|[0-9]{3}))?$",
        "not": {"enum": ["all", "other"]}
      },
      "minItems": 1,
      "uniqueItems": true
    },
    "contentOrigins": {
      "type": "array",
      "items": {
        "type": "string",
        "enum": [
          "KR",
          "CN",
          "JP"
        ]
      },
      "uniqueItems": true
    },
    "contentWarning": {
      "type": "string",
      "enum": [
        "SAFE",
        "MIXED",
        "NSFW"
      ]
    },
    "sourceType": {
      "type": "string",
      "enum": [
        "api",
        "html",
        "hybrid"
      ]
    },
    "requiresAuth": {
      "type": "boolean",
      "default": false
    },
    "requiresWebView": {
      "type": "boolean",
      "default": false
    },
    "status": {
      "type": "string",
      "enum": [
        "ONGOING",
        "COMPLETED",
        "UNKNOWN",
        "PAUSED",
        "DISCONTINUED"
      ]
    },
    "lastVerified": {
      "type": "string",
      "format": "date-time"
    },
    "baseUrl": {
      "type": "string",
      "format": "uri"
    },
    "mirrors": {
      "type": "array",
      "items": {
        "type": "object",
        "properties": {
          "label": {
            "type": "string"
          },
          "url": {
            "type": "string"
          }
        },
        "required": [
          "url"
        ]
      },
      "minItems": 1
    },
    "mobileUrl": {
      "type": "string",
      "format": "uri"
    },
    "headers": {
      "type": "object",
      "additionalProperties": {
        "type": "string"
      }
    },
    "cookies": {
      "type": "array",
      "items": {
        "type": "object",
        "required": [
          "domain",
          "name",
          "value"
        ],
        "additionalProperties": false,
        "properties": {
          "domain": {
            "type": "string"
          },
          "name": {
            "type": "string"
          },
          "value": {
            "type": "string"
          }
        }
      }
    },
    "explore": {
      "type": "object",
      "additionalProperties": {
        "type": "object",
        "properties": {
          "url": {
            "type": "string"
          },
          "method": {
            "type": "string",
            "enum": [
              "GET",
              "POST"
            ]
          },
          "selector": {
            "type": "string"
          },
          "fields": {
            "type": "object"
          },
          "manualPatchRequired": {
            "type": "boolean"
          },
          "pagination": {
            "type": "object"
          },
          "useStaticCatalog": {
            "type": "boolean"
          }
        },
        "if": {
          "properties": {
            "useStaticCatalog": {
              "const": true
            }
          },
          "required": [
            "useStaticCatalog"
          ]
        },
        "then": {
          "properties": {
            "url": false,
            "method": false,
            "selector": false,
            "fields": false,
            "pagination": false
          }
        },
        "else": {
          "if": {
            "properties": {
              "manualPatchRequired": {
                "const": true
              }
            },
            "required": [
              "manualPatchRequired"
            ]
          },
          "then": {},
          "else": {
            "required": [
              "url",
              "method"
            ]
          }
        }
      }
    },
    "search": {
      "type": "object",
      "properties": {
        "url": {
          "type": "string"
        },
        "method": {
          "type": "string",
          "enum": [
            "GET",
            "POST"
          ]
        },
        "selector": {
          "type": "string"
        },
        "fields": {
          "type": "object"
        },
        "manualPatchRequired": {
          "type": "boolean"
        },
        "pagination": {
          "type": "object"
        },
        "useStaticCatalog": {
          "type": "boolean"
        }
      },
      "if": {
        "properties": {
          "useStaticCatalog": {
            "const": true
          }
        },
        "required": [
          "useStaticCatalog"
        ]
      },
      "then": {
        "properties": {
          "url": false,
          "method": false,
          "selector": false,
          "fields": false,
          "pagination": false
        }
      },
      "else": {
        "if": {
          "properties": {
            "manualPatchRequired": {
              "const": true
            }
          },
          "required": [
            "manualPatchRequired"
          ]
        },
        "then": {},
        "else": {
          "required": [
            "url",
            "method"
          ]
        }
      }
    },
    "details": {
      "type": "object",
      "properties": {
        "url": {
          "type": "string"
        },
        "method": {
          "type": "string",
          "enum": [
            "GET",
            "POST"
          ]
        },
        "selector": {
          "type": "string"
        },
        "fields": {
          "type": "object"
        },
        "manualPatchRequired": {
          "type": "boolean"
        }
      },
      "if": {
        "properties": {
          "manualPatchRequired": {
            "const": true
          }
        },
        "required": [
          "manualPatchRequired"
        ]
      },
      "then": {},
      "else": {
        "required": [
          "url",
          "method"
        ]
      }
    },
    "chapters": {
      "type": "object",
      "properties": {
        "url": {
          "type": "string"
        },
        "method": {
          "type": "string",
          "enum": [
            "GET",
            "POST"
          ]
        },
        "isJson": {
          "type": "boolean"
        },
        "listPath": {
          "type": "string"
        },
        "fields": {
          "type": "object"
        },
        "manualPatchRequired": {
          "type": "boolean"
        },
        "selector": {
          "type": "string"
        },
        "reverse": {
          "type": "boolean"
        }
      }
    },
    "pages": {
      "type": "object",
      "properties": {
        "url": {
          "type": "string"
        },
        "method": {
          "type": "string",
          "enum": [
            "GET",
            "POST"
          ]
        },
        "selector": {
          "type": "string"
        },
        "fields": {
          "type": "object"
        },
        "manualPatchRequired": {
          "type": "boolean"
        }
      }
    },
    "provenance": {
      "type": "object",
      "required": [
        "type",
        "upstreamProject",
        "upstreamCommit",
        "upstreamVersion",
        "upstreamLicense",
        "converterVersion",
        "generatedTimestamp"
      ],
      "additionalProperties": false,
      "properties": {
        "type": {
          "type": "string",
          "enum": [
            "converted",
            "native",
            "hybrid"
          ]
        },
        "upstreamProject": {
          "type": "string"
        },
        "upstreamPackage": {
          "type": "string"
        },
        "upstreamSourceId": {
          "type": "string"
        },
        "upstreamCommit": {
          "type": "string",
          "pattern": "^(?!HEAD$)[0-9a-fA-F]{7,40}$"
        },
        "upstreamVersion": {
          "type": "string"
        },
        "upstreamLicense": {
          "type": "string"
        },
        "converterVersion": {
          "type": "string"
        },
        "generatedTimestamp": {
          "type": "string",
          "format": "date-time"
        }
      }
    },
    "staticCatalog": {
      "type": "array",
      "items": {
        "type": "object",
        "required": [
          "title",
          "url"
        ],
        "properties": {
          "title": {
            "type": "string"
          },
          "url": {
            "type": "string"
          }
        },
        "additionalProperties": false
      },
      "minItems": 1
    },
    "familyContract": {
      "type": "string",
      "enum": [
        "globalcomix-v1",
        "namicomi-v1",
        "dongmanmanhua-v1",
        "iqiyi-v1",
        "yellownote-v1",
        "mangadex-v1"
      ]
    }
  },
  "allOf": [
    {
      "if": {
        "not": {
          "required": [
            "staticCatalog"
          ]
        }
      },
      "then": {
        "properties": {
          "search": {
            "properties": {
              "useStaticCatalog": false
            }
          },
          "explore": {
            "patternProperties": {
              "^.*$": {
                "properties": {
                  "useStaticCatalog": false
                }
              }
            }
          }
        }
      }
    }
  ]
}
