{
  "schemaVersion": "0.2",
  "id": "en_readjujutsukaisenmangaonline",
  "name": "Read Jujutsu Kaisen Manga Online",
  "languages": [
    "en"
  ],
  "contentOrigins": [
    "KR",
    "JP",
    "CN"
  ],
  "contentWarning": "SAFE",
  "sourceType": "hybrid",
  "baseUrl": "https://ww6.readjujutsukaisen.com",
  "staticCatalog": [
    {
      "title": "Jujutsu Kaisen",
      "url": "https://ww6.readjujutsukaisen.com/manga/jujutsu-kaisen/"
    },
    {
      "title": "Jujutsu Kaisen 0",
      "url": "https://ww6.readjujutsukaisen.com/manga/jujutsu-kaisen-0/"
    },
    {
      "title": "JJK Colored",
      "url": "https://ww6.readjujutsukaisen.com/manga/jujutsu-kaisen-colored/"
    },
    {
      "title": "Fan Scan",
      "url": "https://ww6.readjujutsukaisen.com/manga/jujutsu-kaisen-fan-scan/"
    },
    {
      "title": "JJK Light Novel",
      "url": "https://ww6.readjujutsukaisen.com/manga/jujutsu-kaisen-first-light-novel/"
    },
    {
      "title": "2nd Light Novel",
      "url": "https://ww6.readjujutsukaisen.com/manga/jujutsu-kaisen-second-light-novel/"
    },
    {
      "title": "No.9",
      "url": "https://ww6.readjujutsukaisen.com/manga/no-9/"
    },
    {
      "title": "Fanbook",
      "url": "https://ww6.readjujutsukaisen.com/manga/jujutsu-kaisen-official-fanbook/"
    }
  ],
  "explore": {
    "popular": {
      "useStaticCatalog": true
    }
  },
  "search": {
    "useStaticCatalog": true
  },
  "details": {
    "url": "manga.url",
    "method": "GET",
    "selector": "div.bg-bg-secondary > div.px-6 > div.flex-col",
    "manualPatchRequired": false,
    "fields": {
      "title": "div.container > h1",
      "description": "text",
      "thumbnail": "div.flex > img@abs:src"
    }
  },
  "chapters": {
    "url": "manga.url",
    "method": "GET",
    "selector": "div.w-full > div.bg-bg-secondary > div.grid",
    "manualPatchRequired": false,
    "fields": {
      "name": ".col-span-4 > a",
      "url": ".col-span-4 > a@abs:href"
    }
  },
  "pages": {
    "url": "chapter.url",
    "method": "GET",
    "selector": "img[data-src]",
    "manualPatchRequired": false,
    "fields": {
      "imageUrl": "@abs:data-src"
    }
  },
  "provenance": {
    "type": "converted",
    "upstreamProject": "keiyoushi",
    "upstreamPackage": "eu.kanade.tachiyomi.extension.en.readjujutsukaisenmangaonline",
    "upstreamSourceId": "808850989053853006",
    "upstreamCommit": "5e06c412c0264b18120fd963fdd6efb529f3fa29",
    "upstreamVersion": "1.4.10",
    "upstreamLicense": "Apache-2.0",
    "converterVersion": "0.1.0",
    "generatedTimestamp": "2026-08-30T00:00:00Z"
  },
  "artifactId": "readjujutsukaisenmangaonline",
  "version": "1.0.3"
}