{
  "schemaVersion": "0.2",
  "id": "en_readsololevelingmangamanhwaonline",
  "name": "Read Solo Leveling Manga Manhwa Online",
  "languages": [
    "en"
  ],
  "contentOrigins": [
    "KR",
    "JP",
    "CN"
  ],
  "contentWarning": "SAFE",
  "sourceType": "hybrid",
  "baseUrl": "https://ww3.readsololeveling.org",
  "staticCatalog": [
    {
      "title": "Solo Leveling Manhwa",
      "url": "https://ww3.readsololeveling.org/manga/solo-leveling/"
    },
    {
      "title": "Solo Leveling Light Novel",
      "url": "https://ww3.readsololeveling.org/manga/solo-leveling-light-novel/"
    },
    {
      "title": "Audio book",
      "url": "https://ww3.readsololeveling.org/manga/solo-leveling-audiobook/"
    },
    {
      "title": "Solo Leveling : Ragnarok",
      "url": "https://ww3.readsololeveling.org/manga/solo-leveling-ragnarok/"
    },
    {
      "title": "SL: Ragnarok Novel",
      "url": "https://ww3.readsololeveling.org/manga/solo-leveling-ragnarok-novel/"
    }
  ],
  "explore": {
    "popular": {
      "useStaticCatalog": true
    }
  },
  "search": {
    "useStaticCatalog": true
  },
  "details": {
    "url": "manga.url",
    "method": "GET",
    "selector": "div.bg-bg-secondary > div.px-6 > div.flex-col",
    "manualPatchRequired": false,
    "fields": {
      "title": "div.container > h1",
      "description": "text",
      "thumbnail": "div.flex > img@abs:src"
    }
  },
  "chapters": {
    "url": "manga.url",
    "method": "GET",
    "selector": "div.w-full > div.bg-bg-secondary > div.grid",
    "manualPatchRequired": false,
    "fields": {
      "name": ".col-span-4 > a",
      "url": ".col-span-4 > a@abs:href"
    }
  },
  "pages": {
    "url": "chapter.url",
    "method": "GET",
    "selector": "img[data-src]",
    "manualPatchRequired": false,
    "fields": {
      "imageUrl": "@abs:data-src"
    }
  },
  "provenance": {
    "type": "converted",
    "upstreamProject": "keiyoushi",
    "upstreamPackage": "eu.kanade.tachiyomi.extension.en.readsololevelingmangamanhwaonline",
    "upstreamSourceId": "1374366734159205648",
    "upstreamCommit": "5e06c412c0264b18120fd963fdd6efb529f3fa29",
    "upstreamVersion": "1.4.10",
    "upstreamLicense": "Apache-2.0",
    "converterVersion": "0.1.0",
    "generatedTimestamp": "2026-08-30T00:00:00Z"
  },
  "artifactId": "readsololevelingmangamanhwaonline",
  "version": "1.0.1"
}
