{
  "schemaVersion": "0.2",
  "id": "keiyoushi_1163192659786040070",
  "name": "NamiComi",
  "languages": [
    "zh-Hans"
  ],
  "contentOrigins": [],
  "contentWarning": "SAFE",
  "sourceType": "api",
  "baseUrl": "https://namicomi.com",
  "mobileUrl": "https://namicomi.com",
  "requiresAuth": false,
  "requiresWebView": false,
  "familyContract": "namicomi-v1",
  "headers": {
    "Referer": "https://namicomi.com/",
    "Origin": "https://namicomi.com"
  },
  "explore": {
    "popular": {
      "url": "https://api.namicomi.com/title/search",
      "method": "GET"
    },
    "latest": {
      "url": "https://api.namicomi.com/title/search",
      "method": "GET"
    }
  },
  "search": {
    "url": "https://api.namicomi.com/title/search",
    "method": "GET",
    "query": {
      "availableTranslatedLanguages[]": "zh-hans"
    },
    "pagination": {
      "limit": 20,
      "offset": "(page-1)*20",
      "hasNext": "meta.limit + meta.offset < meta.total",
      "maxPage": "max(1, ceil(meta.total / meta.limit))"
    }
  },
  "details": {
    "url": "https://api.namicomi.com/title/{comicId}",
    "method": "GET",
    "fields": {
      "title": "data.attributes.title",
      "description": "data.attributes.description"
    }
  },
  "chapters": {
    "url": "https://api.namicomi.com/chapter",
    "method": "GET",
    "query": {
      "translatedLanguages[]": "zh-hans"
    },
    "pagination": {
      "limit": 200,
      "offset": 0,
      "hasNext": "meta.limit + meta.offset < meta.total"
    },
    "access": {
      "url": "https://api.namicomi.com/gating/check",
      "method": "POST",
      "chunkSize": 200,
      "allow": "data.attributes.map[id] === true"
    },
    "order": "volume desc, chapter desc"
  },
  "pages": {
    "url": "https://api.namicomi.com/images/chapter/{chapterId}?newQualities=true",
    "method": "GET",
    "fields": {
      "imageUrl": "data.baseUrl/chapter/{chapterId}/{data.hash}/source/{data.source[].filename}"
    },
    "access": "gating check and HTTP 402 rejection",
    "order": "response"
  },
  "provenance": {
    "type": "converted",
    "upstreamProject": "keiyoushi",
    "upstreamPackage": "eu.kanade.tachiyomi.extension.all.namicomi",
    "upstreamSourceId": "1163192659786040070",
    "upstreamCommit": "5a0261c718cd6d5ecf14963d837f29024c792398",
    "upstreamVersion": "1.4.6",
    "upstreamLicense": "Apache-2.0",
    "converterVersion": "0.1.0",
    "generatedTimestamp": "2026-09-08T16:25:36Z"
  },
  "artifactId": "namicomi_zh_hans",
  "version": "1.0.1"
}
