{
  "schemaVersion": "0.2",
  "id": "en_readkingdommangaonline",
  "name": "Read Kingdom Manga Online",
  "languages": [
    "en"
  ],
  "contentOrigins": [
    "KR",
    "JP",
    "CN"
  ],
  "contentWarning": "SAFE",
  "sourceType": "hybrid",
  "baseUrl": "https://ww6.readkingdom.com",
  "staticCatalog": [
    {
      "title": "Kingdom",
      "url": "https://ww6.readkingdom.com/manga/kingdom/"
    },
    {
      "title": "Li Mu",
      "url": "https://ww6.readkingdom.com/manga/li-mu/"
    },
    {
      "title": "Meng Wu & Chu Zi",
      "url": "https://ww6.readkingdom.com/manga/meng-wu-and-chu-zi-one-shot/"
    },
    {
      "title": "History Spoilers",
      "url": "https://ww6.readkingdom.com/manga/kingdom-history-spoilers/"
    }
  ],
  "explore": {
    "popular": {
      "useStaticCatalog": true
    }
  },
  "search": {
    "useStaticCatalog": true
  },
  "details": {
    "url": "manga.url",
    "method": "GET",
    "selector": "div.bg-bg-secondary > div.px-6 > div.flex-col",
    "manualPatchRequired": false,
    "fields": {
      "title": "div.container > h1",
      "description": "text",
      "thumbnail": "div.flex > img@abs:src"
    }
  },
  "chapters": {
    "url": "manga.url",
    "method": "GET",
    "selector": "div.w-full > div.bg-bg-secondary > div.grid",
    "manualPatchRequired": false,
    "fields": {
      "name": ".col-span-4 > a",
      "url": ".col-span-4 > a@abs:href"
    }
  },
  "pages": {
    "url": "chapter.url",
    "method": "GET",
    "selector": "img[data-src]",
    "manualPatchRequired": false,
    "fields": {
      "imageUrl": "@abs:data-src"
    }
  },
  "provenance": {
    "type": "converted",
    "upstreamProject": "keiyoushi",
    "upstreamPackage": "eu.kanade.tachiyomi.extension.en.readkingdommangaonline",
    "upstreamSourceId": "7952360835727640966",
    "upstreamCommit": "5e06c412c0264b18120fd963fdd6efb529f3fa29",
    "upstreamVersion": "1.4.9",
    "upstreamLicense": "Apache-2.0",
    "converterVersion": "0.1.0",
    "generatedTimestamp": "2026-08-28T16:32:00Z"
  },
  "artifactId": "readkingdommangaonline",
  "version": "1.0.0"
}
