{
  "schemaVersion": "0.2",
  "id": "en_readblackclovermangaonline",
  "name": "Read Black Clover Manga Online",
  "languages": [
    "en"
  ],
  "contentOrigins": [
    "KR",
    "JP",
    "CN"
  ],
  "contentWarning": "SAFE",
  "sourceType": "hybrid",
  "baseUrl": "https://ww10.readblackclover.com",
  "staticCatalog": [
    {
      "title": "Black Clover",
      "url": "https://ww10.readblackclover.com/manga/black-clover/"
    },
    {
      "title": "Fan Colored",
      "url": "https://ww10.readblackclover.com/manga/black-clover-colored/"
    },
    {
      "title": "Hungry Joker",
      "url": "https://ww10.readblackclover.com/manga/hungry-joker/"
    },
    {
      "title": "Gaiden",
      "url": "https://ww10.readblackclover.com/manga/black-clover-gaiden-quartet-knights/"
    }
  ],
  "explore": {
    "popular": {
      "useStaticCatalog": true
    }
  },
  "search": {
    "useStaticCatalog": true
  },
  "details": {
    "url": "manga.url",
    "method": "GET",
    "selector": "div.bg-bg-secondary > div.px-6 > div.flex-col",
    "manualPatchRequired": false,
    "fields": {
      "title": "div.container > h1",
      "description": "text",
      "thumbnail": "div.flex > img@abs:src"
    }
  },
  "chapters": {
    "url": "manga.url",
    "method": "GET",
    "selector": "div.w-full > div.bg-bg-secondary > div.grid",
    "manualPatchRequired": false,
    "fields": {
      "name": ".col-span-4 > a",
      "url": ".col-span-4 > a@abs:href"
    }
  },
  "pages": {
    "url": "chapter.url",
    "method": "GET",
    "selector": "img[data-src]",
    "manualPatchRequired": false,
    "fields": {
      "imageUrl": "@abs:data-src"
    }
  },
  "provenance": {
    "type": "converted",
    "upstreamProject": "keiyoushi",
    "upstreamPackage": "eu.kanade.tachiyomi.extension.en.readblackclovermangaonline",
    "upstreamSourceId": "6485938153129890061",
    "upstreamCommit": "5e06c412c0264b18120fd963fdd6efb529f3fa29",
    "upstreamVersion": "1.4.8",
    "upstreamLicense": "Apache-2.0",
    "converterVersion": "0.1.0",
    "generatedTimestamp": "2026-08-30T00:00:00Z"
  },
  "artifactId": "readblackclovermangaonline",
  "version": "1.0.1"
}
