{
  "schemaVersion": "0.2",
  "id": "en_readonepiecemangaonline",
  "name": "Read One Piece Manga Online",
  "languages": [
    "en"
  ],
  "contentOrigins": [
    "KR",
    "JP",
    "CN"
  ],
  "contentWarning": "SAFE",
  "sourceType": "hybrid",
  "baseUrl": "https://ww12.readonepiece.com",
  "staticCatalog": [
    {
      "title": "One Piece",
      "url": "https://ww12.readonepiece.com/manga/one-piece/"
    },
    {
      "title": "Colored",
      "url": "https://ww12.readonepiece.com/manga/one-piece-digital-colored-comics/"
    },
    {
      "title": "Soma x Sanji",
      "url": "https://ww12.readonepiece.com/manga/shokugeki-no-sanji-one-shot/"
    },
    {
      "title": "OP x Toriko",
      "url": "https://ww12.readonepiece.com/manga/one-piece-x-toriko/"
    },
    {
      "title": "Party",
      "url": "https://ww12.readonepiece.com/manga/one-piece-party/"
    },
    {
      "title": "DB x OP",
      "url": "https://ww12.readonepiece.com/manga/dragon-ball-x-one-piece/"
    },
    {
      "title": "Wanted!",
      "url": "https://ww12.readonepiece.com/manga/wanted-one-piece/"
    },
    {
      "title": "Ace's Story",
      "url": "https://ww12.readonepiece.com/manga/one-piece-ace-s-story/"
    },
    {
      "title": "Omake",
      "url": "https://ww12.readonepiece.com/manga/one-piece-omake/"
    },
    {
      "title": "Vivre Card",
      "url": "https://ww12.readonepiece.com/manga/vivre-card-databook/"
    },
    {
      "title": "Pirate Recipes",
      "url": "https://ww12.readonepiece.com/manga/one-piece-pirate-recipes/"
    },
    {
      "title": "Databook",
      "url": "https://ww12.readonepiece.com/manga/one-piece-databook/"
    },
    {
      "title": "Ace's Story Manga",
      "url": "https://ww12.readonepiece.com/manga/one-piece-ace-story-manga/"
    },
    {
      "title": "OP Academy",
      "url": "https://ww12.readonepiece.com/manga/one-piece-academy/"
    },
    {
      "title": "MONSTERS",
      "url": "https://ww12.readonepiece.com/manga/monsters/"
    },
    {
      "title": "Zoro Novel",
      "url": "https://ww12.readonepiece.com/manga/one-piece-novel-zoro/"
    },
    {
      "title": "OP in Love",
      "url": "https://ww12.readonepiece.com/manga/one-piece-in-love/"
    },
    {
      "title": "Heroines",
      "url": "https://ww12.readonepiece.com/manga/one-piece-novel-heroines/"
    }
  ],
  "explore": {
    "popular": {
      "useStaticCatalog": true
    }
  },
  "search": {
    "useStaticCatalog": true
  },
  "details": {
    "url": "manga.url",
    "method": "GET",
    "selector": "div.bg-bg-secondary > div.px-6 > div.flex-col",
    "manualPatchRequired": false,
    "fields": {
      "title": "div.container > h1",
      "description": "text",
      "thumbnail": "div.flex > img@abs:src"
    }
  },
  "chapters": {
    "url": "manga.url",
    "method": "GET",
    "selector": "div.w-full > div.bg-bg-secondary > div.grid",
    "manualPatchRequired": false,
    "fields": {
      "name": ".col-span-4 > a",
      "url": ".col-span-4 > a@abs:href"
    }
  },
  "pages": {
    "url": "chapter.url",
    "method": "GET",
    "selector": "img[data-src]",
    "manualPatchRequired": false,
    "fields": {
      "imageUrl": "@abs:data-src"
    }
  },
  "provenance": {
    "type": "converted",
    "upstreamProject": "keiyoushi",
    "upstreamPackage": "eu.kanade.tachiyomi.extension.en.readonepiecemangaonline",
    "upstreamSourceId": "1061544757733451419",
    "upstreamCommit": "5e06c412c0264b18120fd963fdd6efb529f3fa29",
    "upstreamVersion": "1.4.8",
    "upstreamLicense": "Apache-2.0",
    "converterVersion": "0.1.0",
    "generatedTimestamp": "2026-08-30T00:00:00Z"
  },
  "artifactId": "readonepiecemangaonline",
  "version": "1.0.1"
}
