{
  "schemaVersion": "0.2",
  "id": "keiyoushi_7151191693036508367",
  "name": "GlobalComix",
  "languages": [
    "zh-Hans"
  ],
  "contentOrigins": [],
  "contentWarning": "MIXED",
  "sourceType": "api",
  "baseUrl": "https://globalcomix.com",
  "mobileUrl": "https://globalcomix.com",
  "requiresAuth": false,
  "requiresWebView": false,
  "familyContract": "globalcomix-v1",
  "headers": {
    "Referer": "https://globalcomix.com/",
    "Origin": "https://globalcomix.com",
    "x-gc-client": "gck_d0f170d5729446dcb3b55e6b3ebc7bf6",
    "x-gc-identmode": "cookie"
  },
  "explore": {
    "popular": {
      "url": "https://api.globalcomix.com/v1/comics",
      "method": "GET"
    },
    "latest": {
      "url": "https://api.globalcomix.com/v1/comics",
      "method": "GET"
    }
  },
  "search": {
    "url": "https://api.globalcomix.com/v1/comics",
    "method": "GET",
    "query": {
      "lang_id[]": "cn"
    },
    "pagination": {
      "page": "p",
      "hasNext": "payload.pagination.page < payload.pagination.total_pages",
      "maxPage": "max(1, payload.pagination.total_pages)"
    }
  },
  "details": {
    "url": "https://api.globalcomix.com/v1/read/{slug}",
    "method": "GET",
    "fields": {
      "title": "payload.results.name",
      "thumbnail": "payload.results.image_url"
    }
  },
  "chapters": {
    "url": "https://api.globalcomix.com/v1/comics/{comicId}/releases",
    "method": "GET",
    "query": {
      "lang_id": "cn",
      "all": "true"
    },
    "listPath": "payload.results",
    "access": "exclude premium_only == 1",
    "order": "response"
  },
  "pages": {
    "url": "https://api.globalcomix.com/v1/readV2/{chapterId}",
    "method": "GET",
    "listPath": "payload.results.page_objects",
    "fields": {
      "imageUrl": "desktop_image_url"
    },
    "access": "reject paid chapter or any paid page",
    "order": "response"
  },
  "provenance": {
    "type": "converted",
    "upstreamProject": "keiyoushi",
    "upstreamPackage": "eu.kanade.tachiyomi.extension.all.globalcomix",
    "upstreamSourceId": "7151191693036508367",
    "upstreamCommit": "5a0261c718cd6d5ecf14963d837f29024c792398",
    "upstreamVersion": "1.4.4",
    "upstreamLicense": "Apache-2.0",
    "converterVersion": "0.1.0",
    "generatedTimestamp": "2026-09-08T16:25:36Z"
  },
  "artifactId": "globalcomix_zh_hans",
  "version": "1.0.1"
}
